Topic,URL,Timestamp
The Art of Automation,https://www.ibm.com/blog/art-of-automation-chapter-2/,2025-04-05 17:32:38
Is RPA Like Screen Scraping?,https://www.youtube.com/watch?v=pH5mbEvfzGg,2025-04-05 17:32:46
Screen Scraping and How Does It Work,"https://www.fortra.com/resources/guides/what-is-screen-scraping-and-how-does-it-work#:~:text=Screen%20scraping%20is%20a%20subset,and%20API%20capabilities%20mentioned%20above",2025-04-05 17:32:52
What is Workflow Automation?,https://www.youtube.com/watch?v=xV-bOHvfbPQ,2025-04-05 17:33:00
The Difference between Personal & Business Workflow Automations (and Why You Need Both),https://www.uipath.com/blog/automation/personal-vs-business-workflow-automations,2025-04-05 17:33:08
What Does RPA Have to Do with AI?,https://www.ibm.com/blog/what-does-rpa-have-to-do-with-ai,2025-04-05 17:33:17
