Topic,URL,Timestamp
The Role Of Artificial Intelligence In Optimising Electric Vehicle Performance,https://inc42.com/resources/the-role-of-artificial-intelligence-in-optimising-electric-vehicle-performance/,2025-04-05 08:15:40
AI in Automotive Industry,https://www.youtube.com/watch?v=bljnP5iVADI,2025-04-05 08:15:45
AI in Electric Vehicles to Improve Battery Performance,https://datafloq.com/read/smart-batteries-driving-the-future-of-electric-vehicles-with-ai/,2025-04-05 08:15:54
Benefits of AI in EVs,https://www.youtube.com/watch?v=jwkc4sgwU9Q,2025-04-05 08:16:05
AI Innovations in Electric Vehicle Manufacturing,https://wdd.my/blog/ai-innovations-in-electric-vehicle-manufacturing/,2025-04-05 08:16:13
Applications of Artificial Intelligence in Electric Vehicle,https://www.linkedin.com/pulse/role-artificial-intelligence-electric-vehicle-mohit-mistry/,2025-04-05 08:16:20
