Topic,URL,Timestamp
Blockchain in FinTech,https://www.youtube.com/watch?v=LAsFJ92dkE8,2025-04-05 17:26:10
Use Cases for Blockchain,https://fintechmagazine.com/articles/top-10-use-cases-for-blockchain,2025-04-05 17:26:16
The Impact of Blockchain on the Financial Services Sector,https://www.youtube.com/watch?v=jd03hf65yoE,2025-04-05 17:26:25
Blockchain and Traditional Finance: Disruption to Transformation,https://www.finextra.com/blogposting/26030/blockchain-and-tradfi-from-disruption-to-transformation,2025-04-05 17:26:33
Infographic: The Disruption of Blockchain on the Financial Sector,https://www.capgemini.com/wp-content/uploads/2017/07/blockchain-infographic_2015.jpg,2025-04-05 17:26:47
How Is Blockchain Changing Financial Services?,https://www.ft.com/content/d0447dcd-9aa5-4f71-9919-5061e77772d5,2025-04-05 17:27:10
Blockchain and the Future of Banking,https://www.robertwalters.com.au/hiring/hiring-advice/Blockchain-technology-and-the-future-of-banking.html,2025-04-05 17:27:19
The Future Of Blockchain In Banking And Financial Services,https://www.everestgrp.com/banking-industry/the-future-of-blockchain-in-banking-and-financial-services-and-fintechs-blog.html,2025-04-05 17:27:28
