Topic,URL,Timestamp
What Is Digital Manufacturing?,https://www.twi-global.com/technical-knowledge/faqs/what-is-digital-manufacturing,2025-04-06 07:58:30
Digital Manufacturing Key Elements,https://builtin.com/articles/digital-manufacturing,2025-04-06 07:58:39
Additive and Digital Manufacturing,https://blog.rgbsi.com/additive-manufacturing-in-digital-engineering,2025-04-06 07:58:47
The Digital Factory and Additive Manufacturing,https://www.3dsystems.com/additive-manufacturing-changes-production,2025-04-06 07:58:58
3D Printing Drives Growth in On-Demand Manufacturing,https://www.forbes.com/sites/carolynschwaar/2022/01/27/3d-printing-drives-growth-in-on-demand-manufacturing/?sh=1531df981997,2025-04-06 07:59:07
