Topic,URL,Timestamp
The Current Status of Artificial Intelligence,https://alltechmagazine.com/what-is/current-status-of-artificial-intelligence/,2025-04-05 09:13:45
The Top 5 AI Trends In 2024,https://www.youtube.com/watch?v=jKhHhOhDifs,2025-04-05 09:13:52
Experts on the Future of AI,https://youtu.be/xZaV89OWrjA,2025-04-05 09:13:59
Industries Revolutionized by Artificial Intelligence,https://marketbusinessnews.com/industries-revolutionized-by-artificial-intelligence/223898/,2025-04-05 09:14:07
AI and the Future of Work,https://www.forbes.com/councils/forbestechcouncil/2024/07/12/ai-and-the-future-of-work/,2025-04-05 09:14:14
The AI Race,https://dobetter.esade.edu/en/who-win-AI-race-market,2025-04-05 09:14:21
