Topic,URL,Timestamp
What Is Industrial Internet of Things or IIoT?,https://www.youtube.com/watch?v=tl2s-rrsfdg,2025-04-05 09:33:12
IIoT vs IoT,https://www.youtube.com/watch?v=yzuQwJ-ejuA,2025-04-05 09:33:19
How Industrial IoT Is Transforming Manufacturing,https://www.youtube.com/watch?v=xUCF9g-ybbg&t=20s,2025-04-05 09:33:28
The Current State of Industrial Internet of Things,https://www.simon-kucher.com/en/insights/decoding-current-state-industrial-internet-things,2025-04-05 09:33:37
10 Examples of Industrial Internet of Things (IIoT) along with Their Applications,https://www.hitechnectar.com/blogs/examples-industrial-internet-of-things/,2025-04-05 09:33:47
IoT in Manufacturing: Benefits and Challenges,https://www.linkedin.com/pulse/iot-manufacturing-benefits-challenges-teksun-2s5df,2025-04-05 09:33:54
