Topic,URL,Timestamp
An Introduction to Deep Learning,https://www.simplilearn.com/tutorials/deep-learning-tutorial/introduction-to-deep-learning,2025-04-05 07:49:09
A Quick Guide to Deep Learning,https://www.cloudflare.com/learning/ai/what-is-deep-learning/,2025-04-05 07:49:17
Convolutional Neural Networks (CNN) Overview,https://encord.com/blog/convolutional-neural-networks-explained/,2025-04-05 07:49:25
Artificial Neural Networks Explained,https://www.electronicshub.org/artificial-neural-networks-ann/,2025-04-05 07:49:33
Deep Learning Use Cases,https://www.matellio.com/blog/deep-learning-business-use-cases/,2025-04-05 07:49:42
Infographic: 10 Truths about Deep Learning,https://miro.medium.com/max/1500/1*Q2lz4CyR7rUMwcRJYQDBNw.jpeg,2025-04-05 07:49:51
