Topic,URL,Timestamp
Everything You Need to Know about Cloud Computing,https://www.infoworld.com/article/2683784/what-is-cloud-computing.html,2025-04-05 12:29:48
Overview of Infrastructure as a Service (IAAS),https://www.youtube.com/watch?v=2cssOR6HJm0,2025-04-05 12:29:55
Overview of Platform as a Service (PAAS),https://www.youtube.com/watch?v=wjdPQpCzPZ4,2025-04-05 12:30:03
What Is Saas?,https://www.youtube.com/watch?v=cjrN-vru2h8,2025-04-05 12:30:10
"What Is the Difference Between SaaS, PaaS, and IaaS?",https://www.youtube.com/watch?v=rcKwb3oCxwY,2025-04-05 12:30:18
